Entry ID,EU Message ID,[ DE Entry Name Pos.],[ DE Entry Name Size],DE Entry Name,[ ES Entry Name Pos.],[ ES Entry Name Size],ES Entry Name,[ FR Entry Name Pos.],[ FR Entry Name Size],FR Entry Name,[ GB Entry Name Pos.],[ GB Entry Name Size],GB Entry Name,PC Flags,[ V],[ A],[ F],[ D],[ E],[ G],Retail Price in %,Order by Prio.,EU Order by ABC,Purchase Price,Feat. 1 ID,[Feat. 1 Name],Pad. 1,Feat. 1 Value,Feat. 2 ID,[Feat. 2 Name],Pad. 2,Feat. 2 Value,Feat. 3 ID,[Feat. 3 Name],Pad. 3,Feat. 3 Value,Feat. 4 ID,[Feat. 4 Name],Pad. 4,Feat. 4 Value,Pad. 5,Pad. 6,[ DE Descr. Pos.],[ DE Descr. Size],DE Descr. Str.,[ ES Descr. Pos.],[ ES Descr. Size],ES Descr. Str.,[ FR Descr. Pos.],[ FR Descr. Size],FR Descr. Str.,[ GB Descr. Pos.],[ GB Descr. Size],GB Descr. Str.
80,0x8c346bec,0x1a279,15,Vyse's Uniform,0x19f07,17,Uniforme de Vyse,0x1a265,17,Uniforme de Vyse,0x19b20,15,Vyse's Uniform,0x31,X,X,"","","",X,50,0,58,60,17,Defense,0,20,18,MagDef,0,20,-1,None,0,0,-1,None,0,0,0,0,0x111d9,67,"Uniform der Blue Rogues, die er von seinem\\nVater geschenkt bekam.",0x10faa,58,Uniforme de los Bandidos Azules.\\nSu padre se lo entregó.,0x11008,50,Uniforme des Voleurs Bleus.\\nOffert par son père.,0x10db1,57,Uniform of the Blue Rogues.\\nGiven to him by his father.
81,0x8c346bfc,0x1a288,14,Aika's Shorts,0x19f18,16,Pantalones Aika,0x1a276,13,Short d'Aika,0x19b2f,14,Aika's Shorts,0x18,"",X,X,"","","",50,1,1,50,17,Defense,0,19,18,MagDef,0,21,-1,None,0,0,-1,None,0,0,0,0,0x1121c,63,"Aikas Lieblingspaar Shorts, die sie von Vyses\\nMutter erhielt.",0x10fe4,76,La madre de Vyse regaló a Aika estos\\npantalones cortos. Son sus favoritos.,0x1103a,51,"Short préféré d'Aika, offert par la mère\\nde Vyse.",0x10dea,64,"Aika's favorite pair of shorts, given to her\\nby Vyse's mother."
82,0x8c346c0c,0x1a296,12,Fina's Robe,0x19f28,15,Túnica de Fina,0x1a283,13,Robe de Fina,0x19b3d,12,Fina's Robe,0x1a,"",X,X,"",X,"",50,11,19,510,17,Defense,0,55,18,MagDef,0,64,-1,None,0,0,-1,None,0,0,0,0,0x1125b,77,"Traditionelle Silviter-Tracht, von Frauen der\\nSilver Civilization getragen.",0x11030,84,Un vestido Silvite tradicional. Lo llevan\\nlas mujeres de la Civilizacion de Plata.,0x1106d,79,"Robe Silvite traditionnelle, portée par les\\nfemmes de la Civilisation Argent.",0x10e2a,72,"A traditional Silvite Dress, worn by women of\\nthe Silver Civilization."
83,0x8c346c18,0x1a2a2,16,Drachma's Shirt,0x19f37,15,Camisa Drachma,0x1a290,16,Chemise Drachma,0x19b49,16,Drachma's Shirt,0x4,"","","",X,"","",50,4,13,340,17,Defense,0,45,18,MagDef,0,42,-1,None,0,0,-1,None,0,0,0,0,0x112a8,80,"Ein extra großes, schweres Hemd, das nach Jahren\\nharter Arbeit abgetragen ist.",0x11084,60,Una enorme camisa muy desgastada por años\\nde duro trabajo.,0x110bc,63,"Chemise lourde et très grande, usée\\npar des années de labeur.",0x10e72,74,"An extra large, heavy shirt that's been well\\nworn by years of hard work."
84,0x8c346c28,0x1a2b2,15,Enrique's Coat,0x19f46,17,Manto de Enrique,0x1a2a0,17,Manteau Impérial,0x19b59,15,Enrique's Coat,0x2,"","","","",X,"",50,33,15,3390,17,Defense,0,119,18,MagDef,0,119,19,Hit%,0,10,20,Dodge%,0,5,0,0,0x112f8,97,Eine leichte Rüstung des kaiserlichen Hofs von\\nValua. Sie erhöht die Beweglichkeit des Trägers.,0x110c0,79,Armadura ligera de la Corte Imperial\\nValuan. Aumenta la agilidad del usuario.,0x110fb,93,L'armure légère de la Cour Impériale Valuan.\\nElle améliore l'agilité de celui qui la porte.,0x10ebc,81,The light armor of the Valuan Imperial Court.\\nIt improves the wearer's agility.
85,0x8c346c38,0x1a2c1,14,Gilder's Mail,0x19f57,13,Malla Gilder,0x1a2b1,17,Maille de Gilder,0x19b68,14,Gilder's Mail,0x25,X,"","",X,"",X,50,27,24,2840,17,Defense,0,116,18,MagDef,0,99,-1,None,0,0,-1,None,0,0,0,0,0x11359,96,"Leichte Rüstung, die Gilder unter seinem Mantel\\nträgt. Er hat gerne Spaß, ist aber nicht dumm.",0x1110f,82,Armadura ligera de la Corte Imperial\\nValuan. El travieso de Gilder no es tonto. ,0x11158,94,Armure légère portée par Gilder sous le manteau.\\nGilder aime s'amuser mais il n'est pas fou.,0x10f0d,90,"Light armor, worn by Gilder under his coat.\\nGilder likes to have fun, but he's no dummy."
86,0x8c346c48,0x1a2cf,11,Light Robe,0x19f64,14,Túnica Ligera,0x1a2c2,12,Robe Légère,0x19b76,11,Light Robe,0x1a,"",X,X,"",X,"",50,3,32,130,17,Defense,0,29,18,MagDef,0,34,-1,None,0,0,-1,None,0,0,0,0,0x113b9,52,Eine leichte Robe aus magieresistentem Material.\\n ,0x11161,70,Una túnica ligera hecha de un material\\nresistente a prueba de magia.,0x111b6,58,Une robe légère fabriquée en tissu résistant à\\nla magie.,0x10f67,62,A lightweight robe crafted from magically\\nresistant fabric. 
87,0x8c346c54,0x1a2da,15,Valuan Uniform,0x19f72,16,Uniforme Valuan,0x1a2ce,16,Uniforme Valuan,0x19b81,15,Valuan Uniform,0x35,X,X,"",X,"",X,50,2,55,170,17,Defense,0,32,18,MagDef,0,32,-1,None,0,0,-1,None,0,0,0,0,0x113ed,89,"Uniform, die von einem valuanischen Seefahrer\\nmit niedrigem Dienstgrad gestohlen wurde.",0x111a7,58,Un uniforme robado de un navegante Valuan\\nde bajo rango.,0x111f0,62,Un uniforme volé à un navigateur Valuan d'un\\nrang inférieur.,0x10fa5,55,A uniform stolen from a low-ranking Valuan\\nnavigator.
88,0x8c346c64,0x1a2e9,15,Sailor Uniform,0x19f82,16,Uniforme Marino,0x1a2de,15,Uniforme Marin,0x19b90,15,Sailor Uniform,0x35,X,X,"",X,"",X,50,5,49,330,17,Defense,0,44,18,MagDef,0,44,-1,None,0,0,-1,None,0,0,0,0,0x11446,66,"Billig, leicht und robust - \\ndie bevorzugte Tracht der Matrosen.",0x111e1,69,"Barato, ligero y resistente. Es el traje\\npreferido por los marinos.",0x1122e,68,"Bon marché, léger et de qualité, c'est l'habit\\npréféré des marins.",0x10fdc,81,"Inexpensive, light weight, and durable, this\\nis the preferred dress of sailors."
89,0x8c346c74,0x1a2f8,13,Mystic Dress,0x19f92,15,Túnica Mística,0x1a2ed,14,Robe Mystique,0x19b9f,13,Mystic Dress,0x18,"",X,X,"","","",75,6,40,310,17,Defense,0,42,18,MagDef,0,46,-1,None,0,0,-1,None,0,0,0,0,0x11488,90,"Ein Kleid aus magieresistentem Material, das\\nseine Trägerin vor Magie-Angriffen schützt.",0x11226,83,Traje con tela a prueba de magia. Inmuniza\\nal usuario contra los ataques magicos.,0x11272,49,Robe fabriquée en tissu résistant à la magie.\\n ,0x1102d,93,A dress made of magically resistant fabric that\\nenables the wearer to resist magic attacks.
90,0x8c346c84,0x1a305,13,Valuan Armor,0x19fa1,16,Armadura Valuan,0x1a2fb,14,Armure Valuan,0x19bac,13,Valuan Armor,0x25,X,"","",X,"",X,50,7,54,480,17,Defense,0,51,18,MagDef,0,44,-1,None,0,0,-1,None,0,0,0,0,0x114e2,91,"Eine alte Rüstung, wie sie von den Wächtern des\\nKaiserlichen Valua-Palasts getragen wird.",0x11279,68,Una vieja armadura usada por guardias\\ndel Palacio Imperial Valuan.,0x112a3,67,Une vieille armure portée par la Garde du\\nPalais Impérial Valuan.,0x1108a,68,On old suit of armor worn by guards in the\\nValuan Imperial Palace.
91,0x8c346c94,0x1a312,10,Elastamor,0x19fb1,10,Elastamor,0x1a309,10,Elastamor,0x19bb9,10,Elastamor,0x3f,X,X,X,X,X,X,50,8,14,580,17,Defense,0,54,18,MagDef,0,54,36,Yellow,0,-2,-1,None,0,0,0,0,0x1153d,57,"Ein enger Anzug, der vor gelben Zaubersprüchen\\nschützt.",0x112bd,79,Un traje ajustado que resiste el deterioro\\nde los hechizos de Magia Amarilla.,0x112e6,70,Costume étroit qui résiste aux dégâts des\\nsortilèges de magie jaune.,0x110ce,68,A tight-fitting suit that resists damage from\\nyellow magic spells.
92,0x8c346ca0,0x1a31c,9,Raincoat,0x19fbb,10,Gabardina,0x1a313,12,Imperméable,0x19bc3,9,Raincoat,0x35,X,X,"",X,"",X,50,9,46,560,17,Defense,0,56,18,MagDef,0,56,-1,None,0,0,-1,None,0,0,0,0,0x11576,78,"Fester Mantel, der von Matrosen zum Schutz\\ngegen die Elemente getragen wird.",0x1130c,81,Gabardina muy resistente que usan los\\nmarinos para protegerse de los elementos.,0x1132c,82,Manteau de qualité porté par les marins pour se\\nse protéger des vents et marées.,0x11112,71,Durable coat worn by sailors to protect them\\nfrom the harsh elements.
93,0x8c346cac,0x1a325,13,Nasrean Mail,0x19fc5,14,Malla Nasrean,0x1a31f,15,Maille Nasrean,0x19bcc,13,Nasrean Mail,0x3f,X,X,X,X,X,X,50,12,43,920,17,Defense,0,66,18,MagDef,0,66,33,Red,0,-2,-1,None,0,0,0,0,0x115c4,89,"Haltbare, leichte Ausstattung für Wüsten-\\nexpeditionen. Schützt Träger vor roter Magie.",0x1135d,82,Malla resistente y ligera para viajar por\\nel desierto. Protege de la Magia Roja.,0x1137e,97,Tenue légère de qualité prévue pour les voyages\\ndans le désert. Elle protège de la Magie Rouge.,0x11159,91,"Durable, lightweight outfit made for desert\\ntravel. Defends the wearer against Red Magic."
94,0x8c346cbc,0x1a332,14,Ceramic Armor,0x19fd3,15,Armadura Barro,0x1a32e,16,Armure d'Argile,0x19bd9,14,Ceramic Armor,0x25,X,"","",X,"",X,50,13,8,1040,17,Defense,0,73,18,MagDef,0,62,-1,None,0,0,-1,None,0,0,0,0,0x1161d,97,"Leichte, aber sehr haltbare Rüstung, die aus ver-\\nschiedenen Arten von Nasr-Lehm gebrannt wird.",0x113af,81,"Armadura ligera, pero resistente, de\\ndistintos tipos de arcilla Nasrean cocida.",0x113df,90,Armure légère mais de qualité créée à partir de\\ndifférents types d'Argile cuite Nasrean.,0x111b4,84,"Light, but very durable armor created from\\nbaking different types of Nasrean Clay."
95,0x8c346ccc,0x1a340,16,Bewegliche Robe,0x19fe2,12,Túnica Ágil,0x1a33e,15,Robe d'Agilité,0x19be7,11,Agile Robe,0xa,"","",X,"",X,"",50,14,0,930,17,Defense,0,65,18,MagDef,0,65,19,Hit%,0,10,20,Dodge%,0,5,0,0,0x1167e,71,"Eine leichtgewichtige Robe, die die Beweglichkeit\\ndes Trägers erhöht.",0x11400,60,Una túnica ligera que aumenta la agilidad\\nde quien la usa.,0x11439,59,Robe légère qui améliore l'agilité de celui qui\\nla porte.,0x11208,55,A lightweight robe that increases the wearer's\\nAgile.
96,0x8c346cd8,0x1a350,17,Miner's Overalls,0x19fee,15,Mono de Minero,0x1a34d,12,Combinaison,0x19bf2,17,Miner's Overalls,0x27,X,"","",X,X,X,25,18,35,910,17,Defense,0,87,18,MagDef,0,80,-1,None,0,0,-1,None,0,0,0,0,0x116c5,53,Dicke Overalls für Bergleute. Fast immer\\nschmutzig.,0x1143c,84,Grueso mono de trabajo de los mineros. Es\\ndifícil encontrar uno que no esté sucio.,0x11474,88,"Combinaison épaisse, portée par les mineurs.\\nIl est difficile d'en trouver une propre.",0x1123f,87,"Thick overalls, worn by miners. It is very\\ndifficult to find a pair that isn't dirty."
97,0x8c346cec,0x1a361,11,Fiber Robe,0x19ffd,16,Túnica de Fibra,0x1a359,15,Robe de Fibres,0x19c03,11,Fiber Robe,0x1a,"",X,X,"",X,"",50,19,18,1040,17,Defense,0,77,18,MagDef,0,90,-1,None,0,0,-1,None,0,0,0,0,0x116fa,89,"Festgewand, das aus Pflanzen gewebt wird.\\nSchützt den Benutzer vor magischen Angriffen.",0x11490,79,Túnica ritual tejida con plantas. Protege\\nal usuario de los ataques de magia.,0x114cc,75,Robe de cérémonie tissée avec des plantes.\\nProtège des attaques magiques.,0x11296,74,Ceremonial Robe woven from plants.\\nProtects the user from magic attacks.
98,0x8c346cf8,0x1a36c,13,Golden Armor,0x1a00d,16,Armadura Dorada,0x1a368,12,Armure d'Or,0x19c0e,13,Golden Armor,0x25,X,"","",X,"",X,100,20,25,2480,17,Defense,0,90,18,MagDef,0,77,-1,None,0,0,-1,None,0,0,0,0,0x11753,83,"Außergewöhnlich schwere Rüstung, die aus dem\\nGold der Ixa'taka geschmiedet wurde.",0x114df,61,Una armadura pesa mucho.\\nEstá forjada con oro de Ixa'takan.,0x11517,51,Armure extrêmement lourde forgée en or\\nIxa'takan.,0x112e0,51,Extremely heavy armor forged from Ixa'takan\\ngold.
99,0x8c346d08,0x1a379,16,Ixa'takan Armor,0x1a01d,16,Armazón de Paño,0x1a374,17,Armure Ixa'takan,0x19c1b,16,Ixa'takan Armor,0x3f,X,X,X,X,X,X,50,31,29,2790,17,Defense,0,109,18,MagDef,0,109,32,Green,0,-2,-1,None,0,0,0,0,0x117a6,82,"Ein Waffenrock für den Dschungel, der den\\nTräger vor grüner Magie schützen soll.",0x1151c,79,Armadura de paño usada en la jungla que\\nprotege de la Magia Verde al usuario.,0x1154a,89,"Tunique portée dans la jungle, conçue pour\\nprotéger celui qui la met de la Magie Verte.",0x11313,84,"A cloth tunic worn in the jungle, designed to\\nprotect the wearer from Green Magic."
100,0x8c346d18,0x1a389,14,Naval Uniform,0x1a02d,15,Uniforme Naval,0x1a385,15,Uniforme Naval,0x19c2b,14,Naval Uniform,0x35,X,X,"",X,"",X,50,32,44,2470,17,Defense,0,112,18,MagDef,0,112,-1,None,0,0,-1,None,0,0,0,0,0x117f8,71,"Leichtere Art von Rüstung, die für\\nÜberraschungsangriffe gedacht ist.",0x1156b,74,"Un tipo de armadura ligera, creado para su\\nuso en misiones clandestinas.",0x115a3,65,"Type d'armure plutôt légère, conçue pour des\\nmissions furtives.",0x11367,62,"A fairly light type of armor, designed for\\nstealth missions."
101,0x8c346d28,0x1a397,13,Nasr Uniform,0x1a03c,14,Uniforme Nasr,0x1a394,14,Uniforme Nasr,0x19c39,13,Nasr Uniform,0x27,X,"","",X,X,X,50,24,42,2070,17,Defense,0,104,18,MagDef,0,96,-1,None,0,0,-1,None,0,0,0,0,0x1183f,86,"Uniform der Nasr-Matrosen. Sie ist in gutem\\nZustand, hat jedoch keine Rangabzeichen.",0x115b5,85,Uniforme diseñado por los marinos de Nasr.\\nEstá en buen estado pero no tiene rango.,0x115e4,86,Un uniforme conçu pour la Marine Nasrean. Il est\\nen bon état mais n'a pas de galons.,0x113a5,92,"A uniform designed for the Nasr Sailors. It's\\nin good condition, but has no rank markings."
102,0x8c346d38,0x1a3a4,14,Caravan Armor,0x1a04a,16,Coraza Desierto,0x1a3a2,17,Armure du désert,0x19c46,14,Caravan Armor,0x35,X,X,"",X,"",X,50,25,7,1930,17,Defense,0,100,18,MagDef,0,100,-1,None,0,0,-1,None,0,0,0,0,0x11895,69,"Dicke Rüstung, die aus den Häuten von\\nWüstentieren gefertigt wurde.",0x1160a,65,Armadura gruesa fabricada con la piel\\nde animales del desierto.,0x1163a,52,Armure épaisse faite en peaux d'animaux du\\ndésert.,0x11401,56,Thick armor made from the hides of the desert\\nanimals.
103,0x8c346d48,0x1a3b2,10,Holy Robe,0x1a05a,15,Túnica Sagrada,0x1a3b3,12,Robe Sainte,0x19c54,10,Holy Robe,0x1a,"",X,X,"",X,"",50,26,27,1520,17,Defense,0,92,18,MagDef,0,108,-1,None,0,0,-1,None,0,0,0,0,0x118da,89,"Heiliges Gewand, von den Priestern von Nasr\\ngetragen. Schützen vor magischen Angriffen.",0x1164b,81,Túnica sagrada que usan los sacerdotes de\\nNasr.Defiende de los ataques mágicos.,0x1166e,79,Robes sacrées portées par les Prêtres de Nasr.\\nProtège des attaques magiques.,0x11439,81,Sacred Robes worn by the Priests of Nasr.\\nProtects the user from magic attacks.
104,0x8c346d54,0x1a3bc,15,Daccat's Tunic,0x1a069,17,Túnica de Daccat,0x1a3bf,16,Veste de Daccat,0x19c5e,15,Daccat's Tunic,0x3f,X,X,X,X,X,X,50,34,10,3500,17,Defense,0,121,18,MagDef,0,121,35,Blue,0,-2,-1,None,0,0,0,0,0x11933,81,"Legendärer Waffenrock, angeblich von Daccat\\ngetragen. Schützt vor blauer Magie.",0x1169c,77,"Según la leyenda, Daccat solía llevar esta\\ntúnica.Protege de la Magia Azul.",0x116bd,95,Une Tunique Légendaire qui aurait été portée par\\nDaccat. Protège des attaques de Magie Bleue.,0x1148a,88,A Legendary Tunic said to have been worn by\\nDaccat. Protects the user from Blue Magic.
105,0x8c346d64,0x1a3cb,17,Battleworn Armor,0x1a07a,15,Armadura Usada,0x1a3cf,15,Vieille armure,0x19c6d,17,Battleworn Armor,0x25,X,"","",X,"",X,50,35,3,3810,17,Defense,0,133,18,MagDef,0,114,-1,None,0,0,-1,None,0,0,0,0,0x11984,96,"Eine vielgetragene Rüstung, die ihrem letzten\\nEigentümer wohl mehrmals das Leben gerettet hat.",0x116e9,87,Armadura desgastada que ha salvado la vida\\nmuchas veces a quien la usaba en combate. ,0x1171c,82,Une armure usée qui aurait sauvé la vie\\nde son ancien propriétaire maintes fois.,0x114e2,91,A well-worn suit of armor that has apparently\\nsaved the previous owner's life many times.
106,0x8c346d78,0x1a3dc,13,Miracle Robe,0x1a089,17,Túnica Milagrosa,0x1a3de,13,Robe Miracle,0x19c7e,13,Miracle Robe,0x1a,"",X,X,"",X,"",50,36,36,2400,17,Defense,0,114,18,MagDef,0,133,-1,None,0,0,-1,None,0,0,0,0,0x119e4,92,"Ein Gewand, das von einem Mönch getragen wurde,\\nder unverletzt vom Dark Rift zurückkehrte.",0x11740,85,"Un monje que, milagrosamente, regresó vivo\\nde la Gruta Oscura, llevaba esta túnica.",0x1176e,55,Robe portée par un moine revenu vivant\\ndu Récif Noir.,0x1153d,93,A robe worn by a monk who miraculously returned\\nunharmed after being lost in the Dark Rift.
107,0x8c346d88,0x1a3e9,11,Scale Mail,0x1a09a,17,Malla de Escamas,0x1a3eb,16,Maille Écailles,0x19c8b,11,Scale Mail,0x27,X,"","",X,X,X,50,39,50,3990,17,Defense,0,141,18,MagDef,0,130,-1,None,0,0,-1,None,0,0,0,0,0x11a40,96,"Sehr effektive Rüstung aus dem Osten, die aus den\\nSchuppen riesiger Lebewesen gefertigt wurde.",0x11795,77,Malla muy útil procedente del Este y hecha\\ncon escamas de animales grandes.,0x117a5,84,"Armure très efficace de l'Est, fabriquée à\\npartir d'écailles de grosses créatures.",0x1159a,86,"Extremely effective armor from the east, crafted\\nfrom the scales of large creatures."
108,0x8c346d94,0x1a3f4,14,Soranchu Robe,0x1a0ab,16,Túnica Soranchu,0x1a3fb,17,Robe de Soranchu,0x19c96,14,Soranchu Robe,0x35,X,X,"",X,"",X,50,40,52,3750,17,Defense,0,136,18,MagDef,0,136,-1,None,0,0,-1,None,0,0,0,0,0x11aa0,97,"Eine Robe, die einem legendären Yafutoma-Aben-\\nteurer gehört, der den Namen “Sky King” erhielt.",0x117e2,81,Túnica que pertenecía a un aventurero\\nYafutoman apodado el “Rey de los cielos”.,0x117f9,86,Une robe appartenant à un aventurier Yafutoman\\nlégendaire surnommé le “Roi du Ciel”.,0x115f0,91,"A robe belonging to a legendary Yafutoman\\nadventurer, who earned the nickname “Sky King.”"
109,0x8c346da4,0x1a402,10,Long Robe,0x1a0bb,13,Túnica Larga,0x1a40c,12,Robe Longue,0x19ca4,10,Long Robe,0xa,"","",X,"",X,"",50,41,33,4110,17,Defense,0,130,18,MagDef,0,130,19,Hit%,0,20,20,Dodge%,0,10,0,0,0x11b01,97,"Ein langes Stück Stoff, das um den Körper des\\nTrägers gewickelt wird. Erhöht die Beweglichkeit.",0x11833,67,Túnica larga que cubre totalmente el\\ncuerpo. Aumenta la agilidad.,0x1184f,97,"Un long châle, conçu pour s'enrouler autour du\\ncorps de celui qui le porte. Améliore l'agilité.",0x1164b,75,"A long cloth, designed to wrap around the\\nwearer's body. Increases Agile."
110,0x8c346db0,0x1a40c,16,Captain's Cloak,0x1a0c8,17,Capa del Capitán,0x1a418,15,Cape Capitaine,0x19cae,16,Captain's Cloak,0x35,X,X,"",X,"",X,50,44,6,4500,17,Defense,0,148,18,MagDef,0,148,-1,None,0,0,-1,None,0,0,0,0,0x11b62,87,"Ein dicker Mantel, der den Kapitän eines Schiffs\\nvor den Naturgewalten schützen soll.",0x11876,78,Gruesa capa que protege al capitán del\\nbarco al enfrentarse a los elementos.,0x118b0,83,"Cape épaisse, conçue pour protéger le capitaine\\nd'un navire bravant les éléments.",0x11696,80,"A thick cloak, designed to protect a ship's\\ncaptain as he braves the elements."
111,0x8c346dc0,0x1a41c,13,Blessed Robe,0x1a0d9,17,Túnica Bendecida,0x1a427,12,Robe Bénite,0x19cbe,13,Blessed Robe,0xa,"","",X,"",X,"",50,45,5,4980,17,Defense,0,142,18,MagDef,0,142,19,Hit%,0,30,20,Dodge%,0,15,0,0,0x11bb9,91,Mit Weihwasser gesegnetes Gewand; es ist leicht\\nund erhöht die Beweglichkeit des Trägers.,0x118c4,85,Túnica ligera bendecida con agua sagrada\\nque dota a quien la lleva de más agilidad.,0x11903,91,"Robe bénite dans l'eau sainte, sa légèreté\\npermet à celui qui la porte d'être plus agile.",0x116e6,83,"Robe blessed in holy water, it's light weight\\nallows the wearer to be more agile."
112,0x8c346dd0,0x1a429,15,Insulated Mail,0x1a0ea,15,Malla Aislante,0x1a433,16,Maille Isolante,0x19ccb,15,Insulated Mail,0x3f,X,X,X,X,X,X,50,46,28,5180,17,Defense,0,145,18,MagDef,0,145,34,Purple,0,-2,-1,None,0,0,0,0,0x11c14,87,Ein undurchlässiger Waffenrock aus sehr dünnem\\nMaterial. Schützt vor purpurner Magie.,0x11919,83,"Malla aislante hecha de un material fino,\\nprotege al usuario de la Magia Púrpura.",0x1195e,93,Tunique isolante fabriquée en tissu très fin.\\nProtège celui qui la porte de la Magie Mauve.,0x11739,87,An insulated tunic made from very thin fabric.\\nProtects the wearer from Purple Magic.
113,0x8c346de0,0x1a438,16,Vengeance Armor,0x1a0f9,16,Armazón Defensa,0x1a443,17,Armure Vengeance,0x19cda,16,Vengeance Armor,0x27,X,"","",X,X,X,50,48,56,6460,17,Defense,0,162,18,MagDef,0,149,73,Counter%,0,10,-1,None,0,0,0,0,0x11c6b,64,"Verzauberte Rüstung, die die Gegenwehr des\\nTrägers verbessert.",0x1196c,76,Armadura encantada que mejora las\\nhabilidades de contraataque del usuario.,0x119bb,86,Armure enchantée qui améliore les aptitudes de\\ncontre-attaque de celui qui la porte.,0x11790,69,Enchanted Armor that improves the wearer's\\ncounterattacking skills.
114,0x8c346df0,0x1a448,12,Swift Dress,0x1a109,12,Traje Veloz,0x1a454,16,Robe de Vitesse,0x19cea,12,Swift Dress,0x18,"",X,X,"","","",75,49,53,5670,17,Defense,0,149,18,MagDef,0,170,4,Quick,0,20,-1,None,0,0,0,0,0x11cab,66,"Verzaubertes Kleid, das die Geschwindigkeit der\\nTrägerin erhöht.",0x119b8,64,Un traje encantado que aumenta la velocidad\\nde quien lo lleva.,0x11a11,63,Robe enchantée qui améliore la vitesse\\nde celui qui la porte.,0x117d5,55,An enchanted dress that increases the wearer's\\nspeed.
115,0x8c346dfc,0x1a454,10,Gaia Cape,0x1a115,10,Capa Gaia,0x1a464,14,Pèlerine Gaia,0x19cf6,10,Gaia Cape,0x35,X,X,"",X,"",X,50,52,22,5910,17,Defense,0,168,18,MagDef,0,168,-1,None,0,0,-1,None,0,0,0,0,0x11ced,93,"Verzauberter Umhang, der den Träger schützt, wenn\\ner auf Abenteuersuche neue Lande betritt.",0x119f8,82,Capa encantada que protege a quien la usa\\ncuando se aventura por nuevas tierras.,0x11a50,90,Pèlerine enchantée protégeant la personne en\\nquête d'aventures sur des terres inconnues.,0x1180c,91,An enchanted Cape that protects the wearer as\\nhe enters new lands in search of adventure.
116,0x8c346e08,0x1a45e,14,Robe of Faith,0x1a11f,16,Túnica de la Fe,0x1a472,15,Robe de la Foi,0x19d00,14,Robe of Faith,0xa,"","",X,"",X,"",50,53,47,6510,17,Defense,0,161,18,MagDef,0,161,19,Hit%,0,30,20,Dodge%,0,15,0,0,0x11d4a,83,Für die Rechtschaffenen. Diese Robe schützt den\\nTräger vor feindlichen Angriffen.,0x11a4a,75,Para los puros de corazón. Esta túnica\\nprotege de muchos tipos de ataque.,0x11aaa,89,Pour la pureté du coeur. Cette robe protègera\\ncelui qui la porte des attaques ennemies.,0x11867,76,For the pure of heart. This robe will protect\\nthe user from enemy attacks.
117,0x8c346e18,0x1a46c,13,Plated Armor,0x1a12f,17,Armadura Chapada,0x1a481,15,Armure blindée,0x19d0e,13,Plated Armor,0x25,X,"","",X,"",X,50,54,45,7430,17,Defense,0,181,18,MagDef,0,154,-1,None,0,0,-1,None,0,0,0,0,0x11d9d,92,"Feine Rüstung, die von den größten Schmieden\\nin der Geschichte Arcadias hergestellt wurde.",0x11a95,84,Armadura forjada artesanalmente por los\\nmejores fabricantes de espadas de Arcadia.,0x11b03,90,Armure fabriquée avec finesse forgée par le plus\\ngrand forgeron de l'histoire d'Arcadia.,0x118b3,74,Finely crafted armor forged by the greatest\\nsmiths in Arcadia's history.
118,0x8c346e28,0x1a479,14,Robe of Truth,0x1a140,14,Túnica Verdad,0x1a490,15,Robe de Vérité,0x19d1b,14,Robe of Truth,0x1a,"",X,X,"",X,"",50,55,48,4590,17,Defense,0,154,18,MagDef,0,181,-1,None,0,0,-1,None,0,0,0,0,0x11df9,88,"Eine leichte Robe, die es dem Träger erlaubt,\\nmagischen Zaubersprüchen zu widerstehen.",0x11ae9,76,Una túnica resistente que protege al que la\\nlleva de los hechizos magicos.,0x11b5d,74,Une robe légère qui permet à son utilisateur de\\nrésister aux sortilèges.,0x118fd,65,A lightweight robe that allows the user to\\nresist magic spells.
119,0x8c346e38,0x1a487,15,Berzerker Mail,0x1a14e,16,Malla Berzerker,0x1a49f,16,Maille de Furie,0x19d29,15,Berzerker Mail,0x27,X,"","",X,X,X,50,56,4,4020,17,Defense,0,140,18,MagDef,0,140,16,Attack,0,20,19,Hit%,0,20,0,0,0x11e51,75,"Ein Waffenrock, der Vyse passt. Er erhöht die\\nKampffähigkeit des Trägers.",0x11b35,77,"Tunica de la talla de Vyse, que aumenta la\\ndestreza en el campo de batalla.",0x11ba7,89,Une tunique qui va bien à Vyse. Elle améliore\\nles talents de combat de son utilisateur.,0x1193e,70,A tunic that fits Vyse. It enhances the wearer's\\nfighting abilities.
120,0x8c346e48,0x1a496,12,Light Dress,0x1a15e,14,Túnica Ligera,0x1a4af,12,Robe d'Aika,0x19d38,12,Light Dress,0x18,"",X,X,"","","",75,57,31,940,17,Defense,0,70,18,MagDef,0,70,20,Dodge%,0,30,4,Quick,0,30,0,0,0x11e9c,87,"Sehr leichte, aber widerstandsfähige Rüstung für\\nAika. Sie erhöht ihre Beweglichkeit.",0x11b82,79,"Armadura de Aika, ligera pero resistente.\\nDiseñada para aumentar su agilidad.",0x11c00,74,Armure très légère mais de qualité pour Aika.\\nElle améliore son agilité.,0x11984,68,"Very light, yet durable armor for Aika. \\nIt increases her agility."
121,0x8c346e54,0x1a4a2,11,Focus Robe,0x1a16c,15,Túnica Enfoque,0x1a4bb,11,Robe Focus,0x19d44,11,Focus Robe,0x18,"",X,X,"","","",75,58,21,970,17,Defense,0,70,18,MagDef,0,70,1,Will,0,100,-1,None,0,0,0,0,0x11ef3,83,"Robe, die es der Trägerin erlaubt, durch mentale\\nEnergie ihren Willen zu stärken.",0x11bd1,84,Esta túnica ayuda a canalizar la energía\\nmental y potenciar la fuerza de voluntad.,0x11c4a,99,"Une robe qui permet à l'utilisateur de canaliser\\nmentalement de l'énergie, augmentant sa volonté.",0x119c8,80,"A Robe that allows the wearer to mentally\\nchannel energy, increasing her will."
122,0x8c346e60,0x1a4ad,17,Nasr Combat Mail,0x1a17b,11,Malla Nasr,0x1a4c6,15,Maille de Nasr,0x19d4f,17,Nasr Combat Mail,0x3f,X,X,X,X,X,X,100,15,41,320,17,Defense,0,66,18,MagDef,0,66,16,Attack,0,5,1,Will,0,5,0,0,0x11f46,93,"Eine alte Uniform, die im Valua-Nasr-Krieg\\ngetragen wurde. Erhöht Angriffskraft und Spirit.",0x11c25,83,Uniforme de la guerra de Valua-Nasr que\\naumenta el poder de Ataque y de Espíritu.,0x11cad,97,Un vieil uniforme porté à la guerre Valua-Nasr.\\nIl augmente la puissance d'attaque et l'Esprit.,0x11a18,79,An old uniform worn in the Valua-Nasr War.\\nIt boosts attack power and spirit.
