Entry ID,EU message ID,[DE entry name pos.],[DE entry name size],DE entry name,[ES entry name pos.],[ES entry name size],ES entry name,[FR entry name pos.],[FR entry name size],FR entry name,[GB entry name pos.],[GB entry name size],GB entry name,Chara. flags,[Vyse],[Aika],[Fina],[Drachma],[Enrique],[Gilder],Retail price in %,Order by prio.,EU order by ABC,Purchase price,Feature #0 ID,[Feature #0 name],Padding #0,Feature #0 value,Feature #1 ID,[Feature #1 name],Padding #1,Feature #1 value,Feature #2 ID,[Feature #2 name],Padding #2,Feature #2 value,Feature #3 ID,[Feature #3 name],Padding #3,Feature #3 value,Padding #4,Padding #5,[DE descr. pos.],[DE descr. size],DE descr. str.,[ES descr. pos.],[ES descr. size],ES descr. str.,[FR descr. pos.],[FR descr. size],FR descr. str.,[GB descr. pos.],[GB descr. size],GB descr. str.
160,2352246632,108149,11,Juwel Ring,107359,15,Anillo de Gema,108205,13,Gemme Sertie,106258,14,Gemstone Ring,58,X,X,X,"",X,"",50,1,23,150,18,MagDef,0,21,-1,None,0,0,-1,None,0,0,-1,None,0,0,0,0,75075,83,"Fein gearbeiter Ring, mit eingravierten Runen,\ndie den Träger vor Magie schützen.",74217,87,"Anillo finamente tallado, con jeroglíficos\nque protegen contra el efecto de la Magia.",74367,95,Une bague finement travaillée avec des runes\ngravées qui protègent l'utilisateur de la Magie.,73740,83,"A finely crafted ring engraved with runes,\nthat protect the wearer against magic."
161,2352246648,108160,15,Prophet's Sand,107374,16,Arena Profética,108218,15,Bague de Sable,106272,15,Prophet's Sand,58,X,X,X,"",X,"",50,3,39,890,18,MagDef,0,63,-1,None,0,0,-1,None,0,0,-1,None,0,0,0,0,75158,91,"Ring aus verzaubertem Sand, den man bei Moon\nStones findet. Schützt den Träger vor Magie.",74304,79,Anillo de arena mágica procedente de\nPiedras Lunares.Protege contra la Magia.,74462,94,Une bague créée avec du sable enchanté trouvé\nprès des Pierres de Lune. Protège de la Magie.,73823,97,A ring created from enchanted sand found around\nMoon Stones. Protects the wearer against Magic.
162,2352246664,108175,17,Meditations Ring,107390,14,Anillo Mágico,108233,17,Bague Méditation,106287,16,Meditation Ring,58,X,X,X,"",X,"",50,0,33,100,1,Will,0,8,-1,None,0,0,-1,None,0,0,-1,None,0,0,0,0,75249,82,Ring aus geflochtenen Zweigen verzauberter\nBäume. Erhöht den Willen des Trägers.,74383,72,Anillo entretejido con ramitas de arboles\nmágicos.Aumenta la Voluntad.,74556,91,Une bague fabriquée à partir d'un arbre magique\nAccroît la Volonté de celui qui la porte.,73920,85,A ring crafted from weaving the sprigs of magic\ntrees. Increases the wearer's Will.
163,2352246680,108192,15,Mondstaub Ring,107404,15,Anillo de Luna,108250,17,Bague Poudrelune,106303,14,Moondust Ring,58,X,X,X,"",X,"",50,4,35,1530,1,Will,0,48,-1,None,0,0,-1,None,0,0,-1,None,0,0,0,0,75331,84,"Ring, der mit kleinen  Moon-Stone-Splittern\nverziert ist. Erhöht die Willenskraft.",74455,74,Anillo decorado con fragmentos de Piedras\nLunares. Potencia la Voluntad.,74647,85,Une bague décorée avec des petits morceaux de\nPierres de Lune. Augmente la Volonté.,74005,67,A ring decorated with tiny shards of Moon\nStones. Increases Will.
164,2352246696,108207,15,Liebenden-Ring,107419,17,Anillo del Amado,108267,17,Bague des amants,106317,13,Lover's Ring,58,X,X,X,"",X,"",50,2,30,300,18,MagDef,0,12,1,Will,0,12,-1,None,0,0,-1,None,0,0,0,0,75415,85,"Fein gearbeiteter Ring, der zwei Liebende\nzeigt. Erhöht Magie-Resistenz und Willen.",74529,84,Anillo con la imagen de dos novios. Protege\ncontra la Magia y aumenta la Voluntad.,74732,97,Bague finement travaillée représentant 2 amants\nenlacés. Accroît Résistance Magique et Volonté.,74072,92,A finely crafted ring that depicts two lovers\nembracing. Increases Magic Defense and Will.
165,2352246712,108222,16,Jade Swirl Ring,107436,15,Anillo de Jade,108284,14,Bague de Jade,106330,16,Jade Swirl Ring,58,X,X,X,"",X,"",50,5,29,2960,18,MagDef,0,45,1,Will,0,45,-1,None,0,0,-1,None,0,0,0,0,75500,92,"Ring, der mit zwei Tropfen flüssiger Jade\nverziert ist. Erhöht Magie-Resistenz und Willen.",74613,81,Anillo con dos gotas de jade que protege\ncontra la Magia y aumenta la Voluntad.,74829,92,Bague décorée avec 2 gouttes de jade liquide.\nAccroît la Résistance Magique et la Volonté.,74164,83,A ring decorated with two drops of liquid jade.\nIncreases Magic Defense and Will.
166,2352246728,108238,11,Cupil Ring,107451,13,Anillo Cupil,108298,15,Bague du Cupil,106346,11,Cupil Ring,8,"","",X,"","","",100,6,14,10000,49,Death,0,-5,37,Silver,0,-5,18,MagDef,0,100,1,Will,0,100,0,0,75592,101,"Ring, der wie Cupil aussieht. Erhöht Spirit sowie\nResistenz gegen Silber-Angriffe und Eterni-Magie.",74694,86,Se parece a Cupil. Potencia el Espíritu.\nResistente Ataques de Plata y Magia Eterni.,74921,98,"Bague à l'image du Cupil. Augmente l'Esprit, la\nRésistance aux Attaques d'Argent & Magie Eterni.",74247,97,"A ring that looks like Cupil. Boosts Spirit and\nResistance to Silver Attacks, and Eterni Magic."
167,2352246740,108249,12,Kriegerherz,107464,15,Corazón Bélico,108313,15,Coeur Guerrier,106357,16,Warrior's Heart,58,X,X,X,"",X,"",100,7,59,10,77,Recover spirit,0,2,-1,None,0,0,-1,None,0,0,-1,None,0,0,0,0,75693,94,"Ein Ring mit leuchtendem Stein; erlaubt dem\nBenutzer, während des Kampfes Spirit aufzuladen.",74780,83,Anillo con una gema brillante. Ayuda a\nrecuperar el Espiritu durante la batalla.,75019,97,"Une bague avec une pierre brillante, qui permet\nde récupérer de l'Esprit pendant les batailles.",74344,82,"A ring with a glowing gem, that allows the user\nto recover Spirit during battle."
168,2352246756,108261,17,Throkryn's Scale,107479,14,Arma Throkryn,108328,17,Écaille Throkryn,106373,17,Throkryn's Scale,53,X,X,"",X,"",X,50,8,55,300,16,Attack,0,10,-1,None,0,0,-1,None,0,0,-1,None,0,0,0,0,75787,75,Ein aus einem Throkryn hergestellter Waffentyp.\nErhöht die Angriffskraft.,74863,59,Arma modificada con Throkryn.\nAumenta el poder de Ataque.,75116,87,"Une arme modifiée, fabriquée à l'aide d'un\nThrokryn. Augmente la Puissance d'Attaque.",74426,66,A weapon modification made from a Throkryn.\nRaises Attack Power.
169,2352246776,108278,17,Thryllak's Scale,107493,14,Arma Thryllak,108345,17,Écaille Thryllak,106390,17,Thryllak's Scale,53,X,X,"",X,"",X,50,9,56,2300,16,Attack,0,36,-1,None,0,0,-1,None,0,0,-1,None,0,0,0,0,75862,94,"Schuppe eines Thryllak, ein Tier, noch tödlicher\nals ein Throkryn. Erhöht die Angriffskraft.",74922,87,"Escamas de Thryllak, animal más mortífero\nque el Throkryn. Mejora el poder de Ataque.",75203,98,"Écaille de Thryllak, animal bien plus dangereux\nque le Throkryn. Accroît la Puissance d'Attaque.",74492,88,"A scale of a Thryllak, an animal even deadlier\nthan the Throkryn. Raises Attack Power."
170,2352246796,108295,16,Maroccas Schale,107507,15,Concha Marocca,108362,17,Bouclier Marocca,106407,16,Marocca's Shell,53,X,X,"",X,"",X,50,10,32,130,17,Defense,0,6,-1,None,0,0,-1,None,0,0,-1,None,0,0,0,0,75956,75,Panzer eines großen primitiven Krustentiers.\nVerbessert die Verteidigung.,75009,70,Concha de un crustáceo primitivo de gran\ntamano. Aumenta la Defensa.,75301,64,La coquille d'un grand crustacé primitif.\nAméliore la Défense.,74580,62,The shell of a large primitive crustacean.\nImproves Defense.
171,2352246812,108311,16,Buroccas Schale,107522,15,Concha Burocca,108379,17,Bouclier Burocca,106423,16,Burocca's Shell,53,X,X,"",X,"",X,50,11,6,1920,17,Defense,0,36,-1,None,0,0,-1,None,0,0,-1,None,0,0,0,0,76031,85,"Schale eines Burocca, noch härter als das der\nMorocca. Verbessert die Verteidigung.",75079,78,"Concha de Burocca, aún más resistente\nque la de Marocca. Aumenta la Defensa.",75365,89,"La coquille d'un Burocca, encore plus dure que\ncelle d'un Marocca. Améliore la Défense.",74642,81,"The shell of a Burocca, even harder than that\nof the Marocca. Improves Defense."
172,2352246828,108327,14,Crylhundklaue,107537,16,Garra Crylhound,108396,17,Griffe Crylhound,106439,17,Crylhound's Claw,53,X,X,"",X,"",X,50,12,13,420,19,Hit%,0,20,16,Attack,0,2,-1,None,0,0,-1,None,0,0,0,0,76116,91,"Eine Waffenart, wie sie von Valua-Soldaten\nbenutzt wird. Verbessert Treffer% und Angriff.",75157,87,Un arma modificada que usan los soldados\nValuan. Aumenta Aciertos% y poder de Ataque.,75454,94,Arme modifiée des Soldats Valuan. Augmente les\nchances de toucher et la Puissance d'Attaque.,74723,81,"A weapon modification used by Valuan Soldiers.\nImproves Hit%, and Attack Power."
173,2352246848,108341,10,Jägerhand,107553,17,Mano del Cazador,108413,17,Gant de Chasseur,106456,14,Hunter's Hand,53,X,X,"",X,"",X,50,13,25,1010,19,Hit%,0,40,16,Attack,0,4,-1,None,0,0,-1,None,0,0,0,0,76207,87,Ein Panzerhandschuh der Ixa'taka für die Jagd.\nVerbessert Treffer% und Angriffskraft.,75244,82,Guante de caza de los hombres de Ixa'takan.\nAumenta Aciertos% y poder de Ataque.,75548,98,Gant porté par les hommes Ixa'takan à la chasse.\nAugmente chances de toucher et Force d'Attaque.,74804,82,A gauntlet worn by Ixa'takan men while hunting. \nImproves Hit% and Attack Power.
174,2352246864,108351,11,Diebesaura,107570,16,Aura del Ladrón,108430,15,Aura du Voleur,106470,13,Thief's Aura,61,X,X,X,X,"",X,50,14,54,330,20,Dodge%,0,10,17,Defense,0,2,-1,None,0,0,-1,None,0,0,0,0,76294,82,"Ring mit schwarzem Stein, der Ausweich% und\nVerteidigung des Trägers verbessert.",75326,77,Anillo con una piedra negra que aumenta el\npoder de Esquivar% y la Defensa.,75646,71,Une bague avec une pierre noire qui améliore\nl'Esquive et la Défense.,74886,74,A ring with a black stone that improves the\nwearer's Dodge% and Defense.
175,2352246880,108362,13,Quetya Feder,107586,13,Pluma Quetya,108445,16,Plume de Quetya,106483,15,Quetya Feather,61,X,X,X,X,"",X,50,15,40,810,20,Dodge%,0,20,17,Defense,0,4,-1,None,0,0,-1,None,0,0,0,0,76376,90,"Federschmuck, dem die Macht der Quetya innewohnt.\nVerbessert Ausweich% und Verteidigung.",75403,86,"Pluma decorativa con el poder del Quetya,\nmejora el poder de Esquivar% y la Defensa.",75717,84,Une plume décorative dotée du pouvoir de Quetya.\nAméliore l'Esquive et la Défense.,74960,86,A feather ornament imbued with the power of the\nQuetya. Improves Dodge% and Defense.
176,2352246896,108375,14,Vigoros Kette,107599,17,Cadena de Vigoro,108461,17,Chaîne de Vigoro,106498,15,Vigoro's Chain,37,X,"","",X,"",X,50,17,58,2890,16,Attack,0,20,19,Hit%,0,30,-1,None,0,0,-1,None,0,0,0,0,76466,81,"So, findet Vigoro, sollte Mode aussehen.\nVerbessert Treffer% und Angriffskraft.",75489,76,La idea de Vigoro de elegancia mejora.\nlos Aciertos% y el poder de Ataque.,75801,97,Vigoro présente sa vision de la mode. Améliore\nles chances de toucher & la Puissance d'Attaque.,75046,71,Vigoro's idea of a fashion statement. Improves\nHit% and Attack Power.
177,2352246912,108389,15,Matrosenschild,107616,14,Escudo Marino,108478,15,Bouclier Marin,106513,17,Sailor's Buckler,55,X,X,"",X,X,X,50,18,43,1930,17,Defense,0,20,20,Dodge%,0,15,-1,None,0,0,-1,None,0,0,0,0,76547,87,"Kleines, leichtes Schild, das Matrosen tragen.\nVerbessert Ausweich% und Verteidigung.",75565,85,Escudo pequeño y ligero de los marinos.\nAumenta el poder de Esquivar% y la Defensa.,75898,81,Un petit bouclier léger porté par les marins.\nAméliore l'Esquive et la Défense.,75117,73,"A light, but small shield worn by sailors.\nImproves Dodge% and Defense."
178,2352246932,108404,12,Kriegerrune,107630,15,Engarce Bélico,108493,17,Rune du Guerrier,106530,15,Warrior's Rune,57,X,X,X,"","",X,100,19,60,10,16,Attack,0,10,17,Defense,0,10,19,Hit%,0,20,20,Dodge%,0,10,0,0,76634,94,"Ring mit mystischen Gravierungen. Verstärkt An-\ngriff, Verteidigung, Treffer% und Ausweich%.",75650,87,"Anillo con engarces misticos. Mejora poder\nde Ataque, Defensa, Aciertos% y Esquivar%.",75979,73,Une bague aux gravures mystiques. Accroît tous\nles attributs de combat.,75190,82,"A ring with mystic engravings. Increases Attack\nPower, Defense, Hit% and Dodge%."
179,2352246948,108416,16,Alter Armschutz,107645,17,Tónico Ancestral,108510,16,Potion Ancienne,106545,15,Ancient Bracer,53,X,X,"",X,"",X,100,20,0,10,16,Attack,0,20,17,Defense,0,20,19,Hit%,0,40,20,Dodge%,0,20,0,0,76728,92,"Armschutz der alten Gladiatoren. Verbessert\nAngriff, Verteidigung, Treffer% und Ausweich%.",75737,87,"Tónico usado por gladiadores. Mejora poder\nde Ataque, Defensa, Aciertos% y Esquivar%.",76052,86,Remontant utilisé par les anciens gladiateurs.\nAccroît tous les attributs de combat.,75272,87,"A bracer used by ancient gladiators. Improves\nAttack Power, Defense, Hit% and Dodge%."
180,2352246964,108432,15,Gegenarmschutz,107662,16,Tónico Ofensivo,108526,17,Potion de combat,106560,15,Counter Bracer,53,X,X,"",X,"",X,100,21,10,10,73,Counter%,0,20,16,Attack,0,20,19,Hit%,0,20,-1,None,0,0,0,0,76820,92,"Geringe Verbesserung physischer Attribute, sowie\nGegenangriff, Angriffskraft und Treffer%.",75824,86,"Mejora los atributos físicos y aumenta el\nContraataque, poder de Ataque y Aciertos%.",76138,92,"Améliore les attributs physiques, la Contre-\nattaque, la Puissance d'Attaque et la Frappe.",75359,92,"Improves physical attributes slightly, as well\nas Counterattacking, Attack Power and Hit%."
181,2352246980,108447,11,Abwehraura,107678,15,Aura Defensiva,108543,15,Aura Défensive,106575,15,Defensive Aura,63,X,X,X,X,X,X,100,22,15,10,65,Block attacks,0,1,17,Defense,0,40,-1,None,0,0,-1,None,0,0,0,0,76912,92,Macht den Träger unverwundbar gegen normale\nAngriffe und verbessert auch die Verteidigung.,75910,81,Quien la lleva se hace invulnerable a\nAtaques normales. También mejora Defensa.,76230,88,"Rend son utilisateur invulnérable aux Attaques\nnormales, et améliore aussi la Défense.",75451,82,"Renders the wearer invulnerable to normal\nAttacks, and improves Defense as well."
182,2352246996,108458,9,Efeuband,107693,13,Banda de Ivy,108558,13,Ruban Lierre,106590,9,Ivy Band,63,X,X,X,X,X,X,100,23,28,100,48,Poison,0,-10,32,Green,0,-2,17,Defense,0,5,18,MagDef,0,5,0,0,77004,87,"Boosts Defense & Magic Defense, especially to\nGreen Magic, & protects against Poison.",75991,85,"Hace invulnerable al Veneno, mejora Defensa y\nResistencia a Magia y Ataques Verdes.",76318,96,Rend invulnérable au Poison. Améliore Défense\net Résistance à la Magie et aux Attaques Vertes.,75533,87,"Boosts Defense & Magic Defense, especially to\nGreen Magic, & protects against Poison."
183,2352247008,108467,13,Silvite Ring,107706,15,Anillo Silvite,108571,14,Bague Silvite,106599,13,Silvite Ring,63,X,X,X,X,X,X,100,30,47,100,49,Death,0,-10,37,Silver,0,-2,17,Defense,0,5,18,MagDef,0,5,0,0,77091,90,"Unverwundbarkeit gegen Eterni, verbessert\nAbwehr, Magie-Resistenz und silberne Angriffe.",76076,87,Inmuniza contra el Eterni y aumenta Defensa\ny Resistencia a Magia y Ataques de Plata.,76414,93,Invulnérabilité à Eterni. Améliore Défense\n& Résistance à la Magie & aux Attaques d'Argent.,75620,87,"Boosts Defense & Magic Defense, especially to\nSilver Magic, & protects against Death."
184,2352247024,108480,16,Gem of Fluidity,107721,16,Gema de Fluidez,108585,14,Pierre Fluide,106612,16,Gem of Fluidity,63,X,X,X,X,X,X,100,29,21,100,50,Stone,0,-10,17,Defense,0,10,18,MagDef,0,10,-1,None,0,0,0,0,77181,73,"Macht immun gegen Versteinerung,\nverbessert Abwehr und Magie-Resistenz.",76163,81,Inmuniza contra la Petrificación y aumenta\nla Defensa y Resistencia a la Magia.,76507,82,"Rend invulnérable à la Pétrification,\naméliore Défense et Résistance à la Magie.",75707,59,"Boosts Defense & Magic Defense, & protects\nagainst Stone."
185,2352247040,108496,14,Wind Gem Ring,107737,15,Gema de Viento,108599,15,Pierre de Vent,106628,14,Wind Gem Ring,63,X,X,X,X,X,X,100,24,62,100,51,Sleep,0,-10,35,Blue,0,-2,17,Defense,0,5,18,MagDef,0,5,0,0,77254,82,"Macht immun gegen Schlaf, verbessert\nAbwehr, Magie-Resistenz und blaue Angriffe.",76244,85,"Inmuniza contra el Sueño y mejora Defensa,\nResistencia a la Magia y Ataques Azules.",76589,97,Rend invulnérable au Sommeil. Améliore Défense\net Résistance à la Magie et aux Attaques Bleues.,75766,85,"Boosts Defense & Magic Defense, especially to\nBlue Magic, & protects against Sleep."
186,2352247056,108510,14,Wahrheitsauge,107752,17,Ojo de la Verdad,108614,15,Oeil de Vérité,106642,13,Eye of Truth,63,X,X,X,X,X,X,100,25,18,100,52,Confuse,0,-10,34,Purple,0,-2,17,Defense,0,5,18,MagDef,0,5,0,0,77336,87,"Macht immun gegen Verwirrung, verbessert\nAbwehr, Magie-Resistenz und Purpur-Angriffe.",76329,88,"Protege contra la Confusión, mejora Defensa\ny Resistencia a Ataques Mágicos y Púrpura.",76686,99,Invulnérabilité à la Confusion & accroît Défense\net Résistance à la Magie et aux Attaques Mauves.,75851,91,"Boosts Defense & Magic Defense, especially to\nPurple Magic, & protects against Confusion."
187,2352247072,108524,16,Verehrte Stimme,107769,17,Voz Reverenciada,108629,13,Voix vénérée,106655,14,Revered Voice,63,X,X,X,X,X,X,100,26,42,100,53,Silence,0,-10,34,Purple,0,-2,17,Defense,0,5,18,MagDef,0,5,0,0,77423,83,"Macht immun gegen Stille, verbessert Abwehr,\nMagie-Resistenz und Purpur-Angriffe.",76417,88,"Inmuniza contra el Silencio, mejora Defensa\ny Resistencia a Ataques Mágicos y Púrpura.",76785,97,Rend invulnérable au Silence & accroît Défense\net Résistance à la Magie et aux Attaques Mauves.,75942,89,"Boosts Defense & Magic Defense, especially to\nPurple Magic, & protects against Silence."
188,2352247088,108540,15,Ewigkeitsjuwel,107786,12,Gema Eterna,108642,17,Pierre Éternelle,106669,16,Everlasting Gem,63,X,X,X,X,X,X,100,28,17,100,54,Fatigue,0,-10,17,Defense,0,10,18,MagDef,0,10,-1,None,0,0,0,0,77506,68,"Macht immun gegen Ermüdung, verbessert\nAbwehr und Magie-Resistenz.",76505,80,Hace invulnerable a la Fatiga y mejora la\nDefensa y la Resistencia a la Magia.,76882,84,Rend invulnérable à la Fatigue et améliore\nla Défense et la Résistance à la Magie.,76031,62,"Boosts Defense & Magic Defense, & protects\nagainst Fatigue."
189,2352247104,108555,16,Behemoth's Ring,107798,16,Anillo Behemoth,108659,15,Bague Behemoth,106685,16,Behemoth's Ring,63,X,X,X,X,X,X,100,27,2,100,56,Weak,0,-10,36,Yellow,0,-2,17,Defense,0,5,18,MagDef,0,5,0,0,77574,84,"Macht immun gegen Schwäche, verbessert\nAbwehr, Magie-Resistenz und gelbe Angriffe.",76585,87,"Protege contra Debilidad, mejora Defensa y\nResistencia a Ataques Mágicos y Amarillos.",76966,99,Invulnérabilité à la Faiblesse & accroît Défense\net Résistance à la Magie et aux Attaques Jaunes.,76093,86,"Boosts Defense & Magic Defense, especially to\nYellow Magic, & protects against Weak."
190,2352247120,108571,17,Constitution Gem,107814,14,Gema Integral,108674,15,Pierre Miracle,106701,17,Constitution Gem,63,X,X,X,X,X,X,100,31,9,1000,79,Block negative states,0,-10,17,Defense,0,10,18,MagDef,0,10,-1,None,0,0,0,0,77658,96,"Wunderbarer Stein, der alle negativen Effekte\nverhindert, steigert Abwehr und Magie-Resistenz.",76672,85,Diamante que anula todo efecto adverso y\npotencia Defensa y Resistencia a la Magia.,77065,99,Pierre miraculeuse empêchant les effets néfastes\net accroissant Défense et Résistance à la Magie.,76179,91,"A miraculous stone that prevents all adverse\neffects, and boosts Defense & Magic Defense."
191,2352247140,108588,16,Nomadenschleier,107828,12,Velo Nómada,108689,16,Voile Nomadique,106718,13,Nomadic Veil,63,X,X,X,X,X,X,50,34,37,640,17,Defense,0,9,18,MagDef,0,9,-1,None,0,0,-1,None,0,0,0,0,77754,96,"Schleier, der von Nomadenstämmen in Nasr getragen\nwird. Verbessert Abwehr und Magie-Resistenz.",76757,84,Velo que usan las tribus nómadas de Nasr.\nMejora Defensa y Resistencia a la Magia.,77164,89,Un voile porté par les tribus nomades à Nasr.\nAccroît Défense et Résistance à la Magie.,76270,78,A veil worn by tribes of nomads in Nasr.\nImproves Defense and Magic Defense.
192,2352247156,108604,12,Radiant Fur,107840,15,Visón Radiante,108705,15,Belle Fourrure,106731,12,Radiant Fur,63,X,X,X,X,X,X,50,39,41,3580,17,Defense,0,24,18,MagDef,0,24,-1,None,0,0,-1,None,0,0,0,0,77850,91,"Dicker Pelz, der Matrosen vor Kälte schützen\nsoll. Verbessert Abwehr und Magie-Resistenz.",76841,83,Grueso abrigo de piel de los marinos.\nMejora la Defensa y Resistencia a la Magia.,77253,95,Fourrure épaisse pour protéger les marins du\nfroid. Accroît Défense et Résistance à la Magie.,76348,94,"A thick fur, designed to protect sailors from \nthe cold. Improves Defense and Magic Defense."
193,2352247168,108616,14,Sandsturmring,107855,16,Anillo de Arena,108720,16,Bague du Désert,106743,16,Sand Storm Ring,63,X,X,X,X,X,X,50,35,44,770,16,Attack,0,9,1,Will,0,9,-1,None,0,0,-1,None,0,0,0,0,77941,74,An enchanted ring worn by desert nomads.\nImproves Attack Power and Will.,76924,85,Anillo encantado usado por nómadas del desierto.\nMejora Poder de Ataque y Voluntad.,77348,90,Bague enchantée portée par les nomades du\ndésert. Améliore Pouvoir d'Attaque et Volonté.,76442,74,An enchanted ring worn by desert nomads.\nImproves Attack Power and Will.
194,2352247184,108630,13,Schädelkappe,107871,15,Gorra Calavera,108736,14,Chapeau Crâne,106759,10,Skull Cap,63,X,X,X,X,X,X,50,40,48,4300,16,Attack,0,24,1,Will,0,24,-1,None,0,0,-1,None,0,0,0,0,78015,90,"Hut, manchmal von Luftpiraten aus dem Osten\ngetragen. Verbessert Angriffskraft & Willen.",77009,84,Gorra exclusiva de los Piratas Aéreos del\nEste. Mejora poder de Ataque y Voluntad.,77438,89,Chapeau original que les Pirates de l'Est\nportent parfois. Améliore Attaque et Volonté.,76516,83,A unique hat sometimes worn by Eastern Air\nPirates. Improves Attack Power & Will.
195,2352247196,108643,12,Magierfluch,107886,17,Conjuro del Mago,108750,14,Fléau du Mage,106769,12,Mage's Bane,63,X,X,X,X,X,X,50,33,31,480,17,Defense,0,4,18,MagDef,0,4,16,Attack,0,4,1,Will,0,4,0,0,78105,76,"Helm, der Angriff, Abwehr, Willen und Magie-\nResistenz des Trägers erhöht.",77093,86,"Casco que mejora poder de Ataque, Voluntad\ny Resistencia a la Magia de quien lo usa.",77527,77,"Un casque qui augmente Attaques, Défense,\nVolonté et Résistance à la Magie.",76599,76,"A helm that increases the wearer's Attack,\nDefense,Will,and Magic Defense."
196,2352247208,108655,17,Blue Rogue Patch,107903,14,Parche Pirata,108764,16,Cache du Voleur,106781,17,Blue Rogue Patch,63,X,X,X,X,X,X,50,41,5,6820,17,Defense,0,18,18,MagDef,0,18,16,Attack,0,18,1,Will,0,18,0,0,78181,97,"Wird getragen, um Entschlusskraft zu zeigen. Ver\n-bessert Angriffe, Willen und Magie-Resistenz.",77179,82,"Indica decisión. Mejora los Ataques,\nDefensa, Voluntad y Resistencia a la Magia.",77604,92,"Montre une grande détermination. Améliore\nAttaques, Défense, Volonté & Résistance Magique.",76675,87,"Can be worn to show determination. Improves\nAttacks, Defense, Will and Magic Defense."
197,2352247228,108672,11,Mörderring,107917,15,Anillo Asesino,108780,17,Bague d'Assassin,106798,14,Assassin Ring,63,X,X,X,X,X,X,50,36,1,3200,80,First strike%,0,40,19,Hit%,0,40,-1,None,0,0,-1,None,0,0,0,0,78278,91,Ein in Nasr gefertigter Ring. Erhöht Wahrschein-\nlichkeit eines Erstschlags und Treffer%.,77261,75,Anillo hecho en Nasr. Aumenta la\nposibilidad de Primer Golpe y Aciertos%.,77696,78,Une bague fabriquée à Nasr. Augmente\nl'initiative et les chances de toucher.,76762,72,"A ring crafted in Nasr. Improves chances for\na First Strike, and Hit%."
198,2352247244,108683,13,Stealth Ring,107932,16,Anillo Sigiloso,108797,14,Bague Furtive,106812,13,Stealth Ring,63,X,X,X,X,X,X,50,37,51,3000,81,Run%,0,100,4,Quick,0,10,20,Dodge%,0,10,-1,None,0,0,0,0,78369,79,"Ring, der Geschicklichkeit und Ausweich%\nverbessert. Man entkommt fast immer.",77336,83,Anillo que aumenta Agilidad y Esquivar%.\nLa mayor parte de las veces puedes huir.,77774,89,Une bague qui améliore Agilité et Esquive. Vous\npouvez vous enfuir la plupart du temps.,76834,90,"A ring that improves Agile and Dodge%. In\nmost cases, you can run away 100% of the time."
199,2352247260,108696,11,Dhabu Haut,107948,12,Cuero Dhabu,108811,14,Cuir de Dhabu,106825,11,Dhabu Hide,63,X,X,X,X,X,X,50,38,16,2800,4,Quick,0,50,-1,None,0,0,-1,None,0,0,-1,None,0,0,0,0,78448,61,"Zusammengefaltetes Stück Dhabu-Leder, als Panzer\nverwendet.",77419,69,Una pieza de cuero Dhabu envejecido\nque hace las veces de armadura.,77863,67,"Un morceau de cuir plié et traité de Dhabu,\nutilisé comme armure.",76924,54,"A folded piece of cured Dhabu hide, used as a\narmor."
200,2352247272,108707,14,Ominöse Maske,107960,16,Máscara Ominosa,108825,16,Masque sinistre,106836,13,Ominous Mask,37,X,"","",X,"",X,50,42,38,4760,68,Reduce spirit,0,1,16,Attack,0,75,17,Defense,0,75,-1,None,0,0,0,0,78509,87,"Verstärkt Angriff und Abwehr gewaltig,\naber reduziert den Spirit der Gruppe auf Null.",77488,85,"Potencia el poder de Ataque y la Defensa,\npero reduce a cero el Espíritu del Grupo.",77930,80,Augmente Puissance d'Attaque et Défense mais\nreduit l'Esprit du groupe à zéro.,76978,90,"Gives a large boost to Attack Power and Defense,\nbut reduces the party's Spirit to zero."
201,2352247288,108721,10,Flitzband,107976,16,Cinta Encantada,108841,12,Ruban Flash,106849,13,Flash Ribbon,29,"",X,X,X,"",X,50,43,19,60,4,Quick,0,2,-1,None,0,0,-1,None,0,0,-1,None,0,0,0,0,78596,56,"Verzaubertes Band, das Aikas Schnelligkeit\nverbessert.",77573,52,Una cinta encantada que mejora la Rapidez\nde Aika.,78010,51,Ruban enchanté qui améliore la Rapidité d'Aika.\n,77068,49,An enchanted Ribbon that improves Aika's\nQuick.
202,2352247304,108731,17,Unsichtbare Hand,107992,15,Mano Invisible,108853,15,La Main Cachée,106862,16,The Unseen Hand,29,"",X,X,X,"",X,50,44,52,2960,4,Quick,0,30,20,Dodge%,0,5,-1,None,0,0,-1,None,0,0,0,0,78652,83,"Zauberspruch, der den Krieger schneller\nattackieren und Feinden ausweichen lässt.",77625,85,Hechizo que da al guerrero el poder de un\nAtaque más rápido y de evitar al enemigo.,78061,93,Enchantement qui permet à un guerrier d'Attaquer\net d'esquiver plus rapidement les ennemis.,77117,76,"An enchantment that enables a warrior to Attack\nfaster, and avoid enemies."
