Entry ID,EU SOT Pos,[Entry GB Name],PS Flags,[L1],[L2],[D1],[D2],[D3],Pad 1,Trait 1 ID,[Trait 1 Name],Pad 2,Trait 1 Value,Trait 2 ID,[Trait 2 Name],Pad 3,Trait 2 Value,Trait 3 ID,[Trait 3 Name],Pad 4,Trait 3 Value,Trait 4 ID,[Trait 4 Name],Pad 5,Trait 4 Value,Pad 6,Pad 7,Buy,Pad 8,Pad 9,Sell%,EU Order 1,EU Order 2,Pad 10,[GB Descr Str]
440,0x8c348034,Rogue Figure,0b00111110,X,X,X,X,X,0,3,MagDef,0,20,-1,None,0,0,-1,None,0,0,-1,None,0,0,0,0,800,0,0,50,0,25,0,"A menacing skull with crossed swords, the symbol
of the Air Pirates. Increases Magic Defense."
441,0x8c348044,Pryn Figure,0b00111110,X,X,X,X,X,0,3,MagDef,0,30,-1,None,0,0,-1,None,0,0,-1,None,0,0,0,0,2400,0,0,50,1,22,0,"Crafted after a mystical red bird, and decorated
with red feathers. Increases Magic Defense."
442,0x8c348050,Pyrynn Figure,0b00111110,X,X,X,X,X,0,3,MagDef,0,45,-1,None,0,0,-1,None,0,0,-1,None,0,0,0,0,4400,0,0,50,2,23,0,"A sculpture based on the mythical guardian of
Pyrynn. Increases Magic Defense."
443,0x8c348060,Arcwhale Figure,0b00111110,X,X,X,X,X,0,3,MagDef,0,60,-1,None,0,0,-1,None,0,0,-1,None,0,0,0,0,4640,0,0,50,3,4,0,"A sculpture of an arcwhale, the guardian of the
skies. Increases Magic Defense."
444,0x8c348070,Quetya Figure,0b00111110,X,X,X,X,X,0,3,MagDef,0,80,-1,None,0,0,-1,None,0,0,-1,None,0,0,0,0,4880,0,0,50,4,24,0,"A sculpture of a Quetya, an Ixa'takan Deity.
Its divine power increases Magic Defense."
445,0x8c348080,Giant Figure,0b00111110,X,X,X,X,X,0,3,MagDef,0,100,-1,None,0,0,-1,None,0,0,-1,None,0,0,0,0,5120,0,0,50,5,16,0,"A sculpture in the form of a giant.
Increases Magic Defense."
446,0x8c348090,Bluheim Figure,0b00111110,X,X,X,X,X,0,3,MagDef,0,130,-1,None,0,0,-1,None,0,0,-1,None,0,0,0,0,5360,0,0,50,6,6,0,"A sculpture of Bluheim, the Yafutoman Gigas.
Increases Magic Defense."
447,0x8c3480a0,Goddess Figure,0b00111110,X,X,X,X,X,0,3,MagDef,0,160,-1,None,0,0,-1,None,0,0,-1,None,0,0,0,0,6800,0,0,50,7,17,0,"A sculpture of the goddess of love, courage,
and victory. Increases Magic Defense."
448,0x8c3480b0,Vyse Figure,0b00111110,X,X,X,X,X,0,3,MagDef,0,190,-1,None,0,0,-1,None,0,0,-1,None,0,0,0,0,8800,0,0,50,8,37,0,"A shameless sculpture of Vyse. 
Increases Magic Defense."
449,0x8c3480bc,Spherical Figure,0b00111110,X,X,X,X,X,0,3,MagDef,0,300,-1,None,0,0,-1,None,0,0,-1,None,0,0,0,0,13500,0,0,50,9,30,0,"A glowing sphere.
Increases Magic Defense."
450,0x8c3480d0,Engine Cover,0b00111110,X,X,X,X,X,0,4,Quick,0,10,6,Dodge%,0,3,-1,None,0,0,-1,None,0,0,0,0,800,0,0,50,10,12,0,"Protects the ship's engine from getting dirty,
and increases the ship's Quick."
451,0x8c3480e0,Turbo Kit,0b00111110,X,X,X,X,X,0,4,Quick,0,20,6,Dodge%,0,5,-1,None,0,0,-1,None,0,0,0,0,1520,0,0,50,11,34,0,"Ship Modification, that increases the Moon Stone
power output, increasing the ship's Quick."
452,0x8c3480ec,Bore-up Kit,0b00111110,X,X,X,X,X,0,4,Quick,0,30,6,Dodge%,0,8,-1,None,0,0,-1,None,0,0,0,0,2400,0,0,50,12,7,0,"A kit that increases engine size for greater
power and exhaust, increasing ship's Quick."
453,0x8c3480f8,Twin Propellers,0b00111110,X,X,X,X,X,0,4,Quick,0,40,6,Dodge%,0,10,-1,None,0,0,-1,None,0,0,0,0,3200,0,0,50,13,35,0,"An additional propeller that increases the
ship's Quick."
454,0x8c348108,Air Intake,0b00111110,X,X,X,X,X,0,4,Quick,0,80,6,Dodge%,0,12,-1,None,0,0,-1,None,0,0,0,0,6800,0,0,50,14,0,0,"Sends clean air into the engine, stabilizing
fuel consumption and increasing ship speed."
455,0x8c348114,Twin Turbo,0b00111110,X,X,X,X,X,0,4,Quick,0,90,6,Dodge%,0,15,-1,None,0,0,-1,None,0,0,0,0,8800,0,0,50,15,36,0,"A compound turbo kit that modifies the engine
and increases the ship's Quick."
456,0x8c348120,Timing Valve,0b00111110,X,X,X,X,X,0,4,Quick,0,100,6,Dodge%,0,17,-1,None,0,0,-1,None,0,0,0,0,10800,0,0,50,16,32,0,"Standardizes valve timing to stabilize engine
exhaust, increasing ship's Quick."
457,0x8c348130,Triple Turbo,0b00111110,X,X,X,X,X,0,4,Quick,0,130,6,Dodge%,0,20,-1,None,0,0,-1,None,0,0,0,0,12800,0,0,50,17,33,0,"A triple turbo kit for maximum engine power, for
a speed boost even greater than the Twin Turbo."
458,0x8c348140,High Torque Kit,0b00111110,X,X,X,X,X,0,4,Quick,0,150,6,Dodge%,0,23,-1,None,0,0,-1,None,0,0,0,0,14800,0,0,50,18,19,0,"Raises durability for greater power through
higher RPM's, increasing ship speed."
459,0x8c348150,Double Shaft,0b00111110,X,X,X,X,X,0,4,Quick,0,200,6,Dodge%,0,26,-1,None,0,0,-1,None,0,0,0,0,16640,0,0,50,19,10,0,"Splits the engine into two independent stages,
doubling power output and increasing ship speed."
460,0x8c348160,Armored Deck,0b00111110,X,X,X,X,X,0,2,Defense,0,10,-1,None,0,0,-1,None,0,0,-1,None,0,0,0,0,1000,0,0,50,20,5,0,"A standard armored deck, commonly available.
Improves ship Defense."
461,0x8c348170,Steel Deck,0b00111110,X,X,X,X,X,0,2,Defense,0,20,-1,None,0,0,-1,None,0,0,-1,None,0,0,0,0,1900,0,0,50,21,31,0,"A deck armored with multiple layers of steel.
Has high defensive power."
462,0x8c34817c,Slanted Deck,0b00111110,X,X,X,X,X,0,2,Defense,0,30,-1,None,0,0,-1,None,0,0,-1,None,0,0,0,0,2200,0,0,50,22,27,0,"Deflects projectiles with slanted plates atop
a standard armored deck. Improves ship Defense."
463,0x8c34818c,Compound Deck,0b00111110,X,X,X,X,X,0,2,Defense,0,40,-1,None,0,0,-1,None,0,0,-1,None,0,0,0,0,5500,0,0,50,23,9,0,"A deck armored with layers of different steels.
Has high defensive power."
464,0x8c34819c,Heavy Armor Deck,0b00111110,X,X,X,X,X,0,2,Defense,0,55,-1,None,0,0,-1,None,0,0,-1,None,0,0,0,0,6700,0,0,50,24,18,0,"A deck with armor three times as thick as the
standard weight. Improves ship Defense."
465,0x8c3481b0,Alloy Deck,0b00111110,X,X,X,X,X,0,2,Defense,0,70,-1,None,0,0,-1,None,0,0,-1,None,0,0,0,0,7300,0,0,50,25,2,0,"A deck armored with an alloy including Moon
Stone dust. Improves ship Defense."
466,0x8c3481bc,Dragon Deck,0b00111110,X,X,X,X,X,0,2,Defense,0,110,-1,None,0,0,-1,None,0,0,-1,None,0,0,0,0,7900,0,0,50,26,11,0,"An armored deck created by Yafutoman craftsmen.
Beautiful and greatly improves ship Defenses."
467,0x8c3481c8,Ancient Deck,0b00111110,X,X,X,X,X,0,2,Defense,0,150,-1,None,0,0,-1,None,0,0,-1,None,0,0,0,0,8500,0,0,50,27,3,0,"A deck armored with a rare, mysterious metal
from ancient times. Improves ship Defense."
468,0x8c3481d8,Silver Deck,0b00111110,X,X,X,X,X,0,2,Defense,0,200,6,Dodge%,0,1,4,Quick,0,3,-1,None,0,0,0,0,11000,0,0,50,28,26,0,"An armored deck supplemented with high grade
Moonstones. Their power improves ship Defense."
469,0x8c3481e4,Sparkling Deck,0b00111110,X,X,X,X,X,0,2,Defense,0,500,6,Dodge%,0,2,4,Quick,0,6,-1,None,0,0,0,0,13500,0,0,50,29,29,0,"An armored deck studded with Moonstones of 6
different colors. Improves ship Defense."
470,0x8c3481f4,Intercom,0b00111110,X,X,X,X,X,0,7,Value,0,1000,-1,None,0,0,-1,None,0,0,-1,None,0,0,0,0,1000,0,0,50,30,21,0,"A system for communicating between decks. 
Good luck keeping Aika from abusing it."
471,0x8c348200,Enhanced Kitchen,0b00111110,X,X,X,X,X,0,7,Value,0,5500,2,Defense,0,1,-1,None,0,0,-1,None,0,0,0,0,5500,0,0,50,31,13,0,"State-of-the-art cooking facilities for great-
tasting dinners every night."
472,0x8c348214,Floor Heater,0b00111110,X,X,X,X,X,0,7,Value,0,3000,3,MagDef,0,1,-1,None,0,0,-1,None,0,0,0,0,3000,0,0,50,32,15,0,"Takes advantage of engine heat to keep
living quarters nice and comfortable."
473,0x8c348224,Air Purifier,0b00111110,X,X,X,X,X,0,7,Value,0,5800,3,MagDef,0,2,-1,None,0,0,-1,None,0,0,0,0,5800,0,0,50,33,1,0,"Purifies the air below decks to keep everything
smelling clean and fresh, not sweaty."
474,0x8c348234,Yafutoman Alcove,0b00111110,X,X,X,X,X,0,7,Value,0,6700,3,MagDef,0,2,-1,None,0,0,-1,None,0,0,0,0,6700,0,0,50,34,39,0,"A bit of Yafutoman culture to help calm the mind
and soothe the soul."
475,0x8c348248,Soundproofing,0b00111110,X,X,X,X,X,0,7,Value,0,11000,2,Defense,0,1,-1,None,0,0,-1,None,0,0,0,0,11000,0,0,50,35,28,0,"Blocks annoying engine noise for a better
night's sleep, reducing fatigue on long trips."
476,0x8c348258,Expensive Wheel,0b00111110,X,X,X,X,X,0,7,Value,0,8500,4,Quick,0,2,-1,None,0,0,-1,None,0,0,0,0,8500,0,0,50,36,14,0,"A custom-made wheel, ergonomically designed in
Valua. Reduces fatigue for the helmsman."
477,0x8c348268,Chandelier,0b00111110,X,X,X,X,X,0,7,Value,0,9300,2,Defense,0,1,-1,None,0,0,-1,None,0,0,0,0,9300,0,0,50,37,8,0,"Luxurious lighting favored by Valuan nobility.
Brings a touch of opulence to airborne life."
478,0x8c348274,Wooden Doll,0b00111110,X,X,X,X,X,0,7,Value,0,7300,-1,None,0,0,-1,None,0,0,-1,None,0,0,0,0,7300,0,0,50,38,38,0,"A carved wooden doll, shaped like a cuddly
animal. Simple, cute, and adored by Fina."
479,0x8c348280,Indoor Plant,0b00111110,X,X,X,X,X,0,-1,None,0,10100,3,MagDef,0,1,-1,None,0,0,-1,None,0,0,0,0,10100,0,0,50,39,20,0,"Some greenery to provide color aboard the ship.
Has a soothing effect, and helps clean the air."
